<hickey-configuration xmlns:xsi="http://www.w3.org/2001/XMLSchema-instance"
                      xmlns="https://github.com/developframework/hickey/schema"
                      xsi:schemaLocation="https://github.com/developframework/hickey/schema hickey-configuration-0.1.xsd">

    <remote-interfaces group-name="test">

        <domain-prefix>http://localhost:8080</domain-prefix>

        <remote-interface id="test-add-student">

            <request method="POST">
                <url>/students</url>
                <parameters>
                    <parameter name="other_param">@{otherParam}</parameter>
                </parameters>
                <headers>
                    <header name="Content-Type">application/xml</header>
                </headers>
                <body type="XML">
                    <provider>
                        <kite-provider namespace="kite-student" template-id="student-detail"/>
                    </provider>
                </body>
            </request>

            <response processor="default"/>

        </remote-interface>

    </remote-interfaces>
</hickey-configuration>